{
  "allowed_mutations": [
    "validation/receipts/stages/**",
    "validation/checkpoints/**",
    "validation/reports/**"
  ],
  "commands": [
    {
      "argv": [
        "python",
        "scripts/validate_launchers.py"
      ],
      "evidence_class": "runtime_execution_pass",
      "required": true,
      "timeout_seconds": 180
    }
  ],
  "entrypoint": {
    "arguments": [
      "run",
      "--stage",
      "20_launcher_validation"
    ],
    "module": "best_buds_weight_station.stage_runner"
  },
  "expected_artifacts": [
    "reports/launcher_validation.v0.1.9.json"
  ],
  "failure_classes": [
    "FAIL",
    "BLOCKED",
    "NOT_RUN"
  ],
  "forbidden_mutations": [
    "context/episodes/episode_0001_v0.1.0.json",
    "context/ledger/ledger.jsonl:historical_lines",
    "manifests/historical_release_manifests"
  ],
  "inputs": [],
  "next_stage": "30_frontend_runtime_validation",
  "pass_conditions": [
    "all required commands exit 0",
    "receipt schema validates"
  ],
  "preconditions": [],
  "purpose": "Execute Linux launch wrappers and validate Windows wrapper source.",
  "receipt_path": "validation/receipts/stages/20_launcher_validation.latest.json",
  "requires": [
    "10_naming_concordance"
  ],
  "stage_id": "20_launcher_validation",
  "version": "0.1.9"
}
